{
  "$schema": "https://json-schema.org/draft/2020-12/schema",
  "$id": "https://example.invalid/trimui-save-vault-journey-v1.schema.json",
  "type": "object",
  "additionalProperties": false,
  "required": ["$schema", "format", "schemaVersion", "fixtureKind", "journeys"],
  "properties": {
    "$schema": {"const": "https://example.invalid/trimui-save-vault-journey-v1.schema.json"},
    "format": {"const": "trimui-save-vault-journey"},
    "schemaVersion": {"const": 1},
    "fixtureKind": {"const": "generated-synthetic-save-vault-journey"},
    "journeys": {"type": "array", "minItems": 8, "uniqueItems": true, "items": {"type": "string", "pattern": "^[a-z0-9-]{1,64}$"}}
  }
}
